{
  "$schema": "../../docs/schemas/world.schema.json",
  "id": "calendar-events-tenerife",
  "title": "Tenerife Events",
  "map": { "center": [28.29, -16.62], "zoom": 10 },
  "baseLayers": [
    {
      "id": "osm",
      "title": "Map",
      "type": "raster-tile",
      "url": "https://tile.openstreetmap.org/{z}/{x}/{y}.png",
      "attribution": "© OpenStreetMap contributors"
    },
    {
      "id": "satellite",
      "title": "Satellite",
      "type": "raster-tile",
      "url": "https://server.arcgisonline.com/ArcGIS/rest/services/World_Imagery/MapServer/tile/{z}/{y}/{x}",
      "attribution": "Tiles © Esri — Source: Esri, Maxar, Earthstar Geographics, and the GIS User Community"
    }
  ],
  "dataLayers": ["layers/events.layer.json"],
  "calendar": { "default": "today", "min": "2026-01-01", "max": "2026-12-31" },
  "strings": "strings.json"
}
