{
  "$schema": "../../docs/schemas/world.schema.json",
  "id": "events-canary-islands",
  "title": "Eventos de Canarias",
  "map": {
    "center": [
      28.35,
      -15.6
    ],
    "zoom": 8
  },
  "baseLayers": [
    {
      "id": "osm",
      "title": "Map",
      "type": "raster-tile",
      "url": "https://tile.openstreetmap.org/{z}/{x}/{y}.png",
      "attribution": "© OSM"
    },
    {
      "id": "satellite",
      "title": "Satellite",
      "type": "raster-tile",
      "url": "https://server.arcgisonline.com/ArcGIS/rest/services/World_Imagery/MapServer/tile/{z}/{y}/{x}",
      "attribution": "Tiles © Esri — Source: Esri, Maxar, Earthstar Geographics, and the GIS User Community",
      "labelsUrl": "https://server.arcgisonline.com/ArcGIS/rest/services/Reference/World_Boundaries_and_Places/MapServer/tile/{z}/{y}/{x}",
      "labelsAttribution": "Tiles © Esri — Source: Esri, Garmin, HERE, and other contributors"
    }
  ],
  "dataLayers": [
    "layers/events.layer.json"
  ],
  "calendar": {
    "default": "today",
    "min": "2026-01-01",
    "max": "2026-12-31"
  },
  "strings": "strings.en.json",
  "theme": {
    "primary": "#c2571f"
  },
  "welcome": true,
  "contentLanguage": "es"
}
