{
  "$schema": "../../docs/schemas/world.schema.json",
  "id": "moon-map-photos",
  "title": "Fotos de la Luna",
  "map": {
    "center": [
      47,
      2
    ],
    "zoom": 5
  },
  "baseLayers": [
    {
      "id": "osm",
      "title": "Map",
      "type": "raster-tile",
      "url": "https://tile.openstreetmap.org/{z}/{x}/{y}.png",
      "attribution": "© OSM"
    },
    {
      "id": "satellite",
      "title": "Satellite",
      "type": "raster-tile",
      "url": "https://server.arcgisonline.com/ArcGIS/rest/services/World_Imagery/MapServer/tile/{z}/{y}/{x}",
      "attribution": "Tiles © Esri — Source: Esri, Maxar, Earthstar Geographics, and the GIS User Community",
      "labelsUrl": "https://server.arcgisonline.com/ArcGIS/rest/services/Reference/World_Boundaries_and_Places/MapServer/tile/{z}/{y}/{x}",
      "labelsAttribution": "Tiles © Esri — Source: Esri, Garmin, HERE, and other contributors"
    }
  ],
  "dataLayers": [
    "layers/photos.layer.json"
  ],
  "calendar": {
    "default": "2026-07-01",
    "min": "2026-07-01",
    "max": "2026-07-31"
  },
  "strings": "strings.en.json",
  "theme": {
    "primary": "#2c3e6b"
  },
  "welcome": true,
  "contentLanguage": "es",
  "translations": ["en"]
}
