{
  "$schema": "../../docs/schemas/world.schema.json",
  "id": "paranormal-espana",
  "title": "Paranormal Spain",
  "map": { "center": [28.389, -16.5245], "zoom": 15 },
  "baseLayers": [
    {
      "id": "osm",
      "title": "Map",
      "type": "raster-tile",
      "url": "https://tile.openstreetmap.org/{z}/{x}/{y}.png",
      "attribution": "© OpenStreetMap contributors"
    },
    {
      "id": "satellite",
      "title": "Satellite",
      "type": "raster-tile",
      "url": "https://server.arcgisonline.com/ArcGIS/rest/services/World_Imagery/MapServer/tile/{z}/{y}/{x}",
      "attribution": "Tiles © Esri — Source: Esri, Maxar, Earthstar Geographics, and the GIS User Community"
    }
  ],
  "dataLayers": ["layers/lugares.layer.json"],
  "calendar": { "default": "today", "min": "1500-01-01", "max": "2030-12-31" },
  "systems": { "time": false }
}
