{
  "$schema": "../../docs/schemas/world.schema.json",
  "id": "paranormal-spain",
  "title": "Paranormal España",
  "map": {
    "center": [
      40.0,
      -3.7
    ],
    "zoom": 6
  },
  "baseLayers": [
    {
      "id": "osm",
      "title": "Map",
      "type": "raster-tile",
      "url": "https://tile.openstreetmap.org/{z}/{x}/{y}.png",
      "attribution": "© OSM"
    },
    {
      "id": "satellite",
      "title": "Satellite",
      "type": "raster-tile",
      "url": "https://server.arcgisonline.com/ArcGIS/rest/services/World_Imagery/MapServer/tile/{z}/{y}/{x}",
      "attribution": "Tiles © Esri — Source: Esri, Maxar, Earthstar Geographics, and the GIS User Community",
      "labelsUrl": "https://server.arcgisonline.com/ArcGIS/rest/services/Reference/World_Boundaries_and_Places/MapServer/tile/{z}/{y}/{x}",
      "labelsAttribution": "Tiles © Esri — Source: Esri, Garmin, HERE, and other contributors"
    }
  ],
  "dataLayers": [
    "layers/regions.layer.json",
    "layers/lugares.layer.json"
  ],
  "calendar": {
    "default": "today",
    "min": "1500-01-01",
    "max": "2030-12-31"
  },
  "strings": "strings.en.json",
  "theme": {
    "primary": "#4a2265"
  },
  "systems": {
    "time": false
  },
  "welcome": true,
  "contentLanguage": "es",
  "translations": ["en"]
}
